<?xml version="1.0" encoding="UTF-8"?>
<list xmlns:xsi="http://www.w3.org/2001/XMLSchema-instance" xsi:noNamespaceSchemaLocation="../../xsd/cubics.xsd">
	<cubic id="15" level="1" slot="11" duration="900" delay="13" maxCount="50" useUp="0" power="2106.0" targetType="BY_SKILL">
		<skills>
			<skill id="11294" level="1" triggerRate="10" successRate="33" canUseOnStaticObjects="true" target="TARGET"> <!-- Cubic Root -->
				<conditions>
					<hp type="GREATER" percent="30" />
					<range value="1000" />
				</conditions>
			</skill>
			<skill id="11293" level="1" triggerRate="10" successRate="45" target="TARGET"> <!-- Cubic Cancellation -->
				<conditions>
					<hp type="GREATER" percent="30" />
					<range value="1000" />
				</conditions>
			</skill>
			<skill id="11292" level="1" triggerRate="80" successRate="99" target="MASTER" targetDebuff="true" /> <!-- Cubic Cleanse -->
		</skills>
	</cubic>
	<cubic id="15" level="2" slot="11" duration="900" delay="13" maxCount="50" useUp="0" power="2106.0" targetType="BY_SKILL">
		<skills>
			<skill id="11294" level="2" triggerRate="10" successRate="33" canUseOnStaticObjects="true" target="TARGET"> <!-- Cubic Root -->
				<conditions>
					<hp type="GREATER" percent="30" />
					<range value="1000" />
				</conditions>
			</skill>
			<skill id="11293" level="2" triggerRate="10" successRate="45" target="TARGET"> <!-- Cubic Cancellation -->
				<conditions>
					<hp type="GREATER" percent="30" />
					<range value="1000" />
				</conditions>
			</skill>
			<skill id="11292" level="2" triggerRate="80" successRate="99" target="MASTER" targetDebuff="true" /> <!-- Cubic Cleanse -->
		</skills>
	</cubic>
	<cubic id="15" level="3" slot="11" duration="900" delay="13" maxCount="50" useUp="0" power="2106.0" targetType="BY_SKILL">
		<skills>
			<skill id="11294" level="3" triggerRate="10" successRate="33" canUseOnStaticObjects="true" target="TARGET"> <!-- Cubic Root -->
				<conditions>
					<hp type="GREATER" percent="30" />
					<range value="1000" />
				</conditions>
			</skill>
			<skill id="11293" level="3" triggerRate="10" successRate="45" target="TARGET"> <!-- Cubic Cancellation -->
				<conditions>
					<hp type="GREATER" percent="30" />
					<range value="1000" />
				</conditions>
			</skill>
			<skill id="11292" level="3" triggerRate="80" successRate="99" target="MASTER" targetDebuff="true" /> <!-- Cubic Cleanse -->
		</skills>
	</cubic>
	<cubic id="15" level="4" slot="11" duration="900" delay="13" maxCount="50" useUp="0" power="2106.0" targetType="BY_SKILL">
		<skills>
			<skill id="11294" level="4" triggerRate="10" successRate="33" canUseOnStaticObjects="true" target="TARGET"> <!-- Cubic Root -->
				<conditions>
					<hp type="GREATER" percent="30" />
					<range value="1000" />
				</conditions>
			</skill>
			<skill id="11293" level="4" triggerRate="10" successRate="45" target="TARGET"> <!-- Cubic Cancellation -->
				<conditions>
					<hp type="GREATER" percent="30" />
					<range value="1000" />
				</conditions>
			</skill>
			<skill id="11292" level="4" triggerRate="80" successRate="99" target="MASTER" targetDebuff="true" /> <!-- Cubic Cleanse -->
		</skills>
	</cubic>
	<cubic id="15" level="5" slot="11" duration="900" delay="13" maxCount="50" useUp="0" power="2106.0" targetType="BY_SKILL">
		<skills>
			<skill id="11294" level="5" triggerRate="10" successRate="33" canUseOnStaticObjects="true" target="TARGET"> <!-- Cubic Root -->
				<conditions>
					<hp type="GREATER" percent="30" />
					<range value="1000" />
				</conditions>
			</skill>
			<skill id="11293" level="5" triggerRate="10" successRate="45" target="TARGET"> <!-- Cubic Cancellation -->
				<conditions>
					<hp type="GREATER" percent="30" />
					<range value="1000" />
				</conditions>
			</skill>
			<skill id="11292" level="5" triggerRate="80" successRate="99" target="MASTER" targetDebuff="true" /> <!-- Cubic Cleanse -->
		</skills>
	</cubic>
	<cubic id="15" level="6" slot="11" duration="900" delay="13" maxCount="50" useUp="0" power="2106.0" targetType="BY_SKILL">
		<skills>
			<skill id="11294" level="6" triggerRate="10" successRate="33" canUseOnStaticObjects="true" target="TARGET"> <!-- Cubic Root -->
				<conditions>
					<hp type="GREATER" percent="30" />
					<range value="1000" />
				</conditions>
			</skill>
			<skill id="11293" level="6" triggerRate="10" successRate="45" target="TARGET"> <!-- Cubic Cancellation -->
				<conditions>
					<hp type="GREATER" percent="30" />
					<range value="1000" />
				</conditions>
			</skill>
			<skill id="11292" level="6" triggerRate="80" successRate="99" target="MASTER" targetDebuff="true" /> <!-- Cubic Cleanse -->
		</skills>
	</cubic>
	<cubic id="15" level="7" slot="11" duration="900" delay="13" maxCount="50" useUp="0" power="2106.0" targetType="BY_SKILL">
		<skills>
			<skill id="11294" level="7" triggerRate="10" successRate="33" canUseOnStaticObjects="true" target="TARGET"> <!-- Cubic Root -->
				<conditions>
					<hp type="GREATER" percent="30" />
					<range value="1000" />
				</conditions>
			</skill>
			<skill id="11293" level="7" triggerRate="10" successRate="45" target="TARGET"> <!-- Cubic Cancellation -->
				<conditions>
					<hp type="GREATER" percent="30" />
					<range value="1000" />
				</conditions>
			</skill>
			<skill id="11292" level="7" triggerRate="80" successRate="99" target="MASTER" targetDebuff="true" /> <!-- Cubic Cleanse -->
		</skills>
	</cubic>
	<cubic id="15" level="8" slot="11" duration="900" delay="13" maxCount="50" useUp="0" power="2106.0" targetType="BY_SKILL">
		<skills>
			<skill id="11294" level="8" triggerRate="10" successRate="33" canUseOnStaticObjects="true" target="TARGET"> <!-- Cubic Root -->
				<conditions>
					<hp type="GREATER" percent="30" />
					<range value="1000" />
				</conditions>
			</skill>
			<skill id="11293" level="8" triggerRate="10" successRate="45" target="TARGET"> <!-- Cubic Cancellation -->
				<conditions>
					<hp type="GREATER" percent="30" />
					<range value="1000" />
				</conditions>
			</skill>
			<skill id="11292" level="8" triggerRate="80" successRate="99" target="MASTER" targetDebuff="true" /> <!-- Cubic Cleanse -->
		</skills>
	</cubic>
	<cubic id="15" level="9" slot="11" duration="900" delay="13" maxCount="50" useUp="0" power="2106.0" targetType="BY_SKILL">
		<skills>
			<skill id="11294" level="9" triggerRate="10" successRate="33" canUseOnStaticObjects="true" target="TARGET"> <!-- Cubic Root -->
				<conditions>
					<hp type="GREATER" percent="30" />
					<range value="1000" />
				</conditions>
			</skill>
			<skill id="11293" level="8" triggerRate="10" successRate="45" target="TARGET"> <!-- Cubic Cancellation -->
				<conditions>
					<hp type="GREATER" percent="30" />
					<range value="1000" />
				</conditions>
			</skill>
			<skill id="11292" level="8" triggerRate="80" successRate="99" target="MASTER" targetDebuff="true" /> <!-- Cubic Cleanse -->
		</skills>
	</cubic>
	<cubic id="15" level="10" slot="11" duration="900" delay="13" maxCount="50" useUp="0" power="2106.0" targetType="BY_SKILL">
		<skills>
			<skill id="11294" level="10" triggerRate="10" successRate="33" canUseOnStaticObjects="true" target="TARGET"> <!-- Cubic Root -->
				<conditions>
					<hp type="GREATER" percent="30" />
					<range value="1000" />
				</conditions>
			</skill>
			<skill id="11293" level="8" triggerRate="10" successRate="45" target="TARGET"> <!-- Cubic Cancellation -->
				<conditions>
					<hp type="GREATER" percent="30" />
					<range value="1000" />
				</conditions>
			</skill>
			<skill id="11292" level="8" triggerRate="80" successRate="99" target="MASTER" targetDebuff="true" /> <!-- Cubic Cleanse -->
		</skills>
	</cubic>
	<cubic id="15" level="11" slot="11" duration="900" delay="13" maxCount="50" useUp="0" power="2106.0" targetType="BY_SKILL">
		<skills>
			<skill id="11294" level="11" triggerRate="10" successRate="33" canUseOnStaticObjects="true" target="TARGET"> <!-- Cubic Root -->
				<conditions>
					<hp type="GREATER" percent="30" />
					<range value="1000" />
				</conditions>
			</skill>
			<skill id="11293" level="8" triggerRate="10" successRate="45" target="TARGET"> <!-- Cubic Cancellation -->
				<conditions>
					<hp type="GREATER" percent="30" />
					<range value="1000" />
				</conditions>
			</skill>
			<skill id="11292" level="8" triggerRate="80" successRate="99" target="MASTER" targetDebuff="true" /> <!-- Cubic Cleanse -->
		</skills>
	</cubic>
</list>